### ISSUE TITLE
Using edgeshark shows 127.0.0.1 keep alives in wireshark

### ISSUE THREAD

**Issue by pcfriek1987** [siemens/edgeshark#44]
I was trying out edgeshark but whenever I click on an wireshark link in a connection it shows a scrolling of 127.0.0.1 keep alives where normal wireshark traffic gets overrun. I can exclude traffic to 127.0.0.1 of course but this way it's very hard to use it.

What have I tried?
Macos with the latest wireshark and cshargextcap
Windows with the latest wireshark and cshargextcap

2 different containerlab servers with a srlinux lab, my own and one shared by the Srlinux team. 

I've attached a capture of the traffic seen by edgeshark for a port.
[wireshark capture.pcapng.zip](https://github.com/siemens/edgeshark/files/14237122/wireshark.capture.pcapng.zip)

This was done by using port 5000 on a public IP, not an ssh tunnel.

In case any more questions arise, feel free to ask.

**Comment by thediveo** [comment]
What are "keep alives"?

Which 127.0.0.1 are you capturing from? There are many in a container host. Are you capturing the websocket streaming connection on localhost? In this case you currently need to use Wireshark directly and set an appropriate capture filter before starting any capture on a network interface that also is taking part in the live streaming.

Please note that all that Edgeshark does is to take Wireshark's `dumpcap` and run it attached to a particular network namespace. It pipes its own

**Comment by hellt** [comment]
m, indeed this happens in our setups as well, but only if we pick the interface from our SR Linux Network OS container

If you open this public instance https://3ec0-131-228-2-27.ngrok-free.app/w and try capturing from e1-10 interface of `clab-vlan-srl1` then you will those keepalives sent between processes over the loopback interface
<img width="1404" alt="image" src="https://github.com/siemens/edgeshark/assets/5679861/c61ad657-a1f4-4b7c-9a78-d306b2cb4b37">


When I just use tcpdump over the same interface it works as expected (no keepalives)

```
ip netns exec clab-vlan-srl1 tcpdump -nni e1-10
tcpdump: verbose output suppressed, use -v[v]... for full protocol decode
listening on e1-10, link-type EN10MB (Ethernet), snapshot length 262144 bytes
^C13:05:50.305371 IP 10.1.0.1 > 10.1.0.2: ICMP echo request, id 210, seq 5, length 64
13:05:50.305604 IP 10.1.0.2 > 10.1.0.1: ICMP echo reply, id 210, seq 5, length 64
13:05:51.297398 ARP, Request who-has 10.1.0.1 tell 10.1.0.2, length 28
13:05:51.297588 ARP, Reply 10.1.0.1 is-at aa:c1:ab:00:00:01, length 28
13:05:51.329318 IP 10.1.0.1 > 10.1.0.2: ICMP echo request, id 210, seq 6, length 64
13:05:51.329470 IP 10.1.0.2 > 10.1.0.1: ICMP echo reply, id 210, seq 6, length 64
```

So I wonder, does dumpcap doesn't actually constraint itself with the interface value?

**Comment by thediveo** [comment]
Can you please check the logs from the edgeshark-edgeshark-1 service? It should contain logs about a new capture session starting, as well as the interfaces it has been told to attach to.

**Comment by thediveo** [comment]
Ouch, I just notice that this information currently isn't shown.

**Comment by hellt** [comment]
@thediveo if you push/send a test version I can test it out
unless you want to deploy this tiny lab yourself:

([install](https://containerlab.dev/install/) containerlab)

```
containerlab deploy -t https://github.com/srl-labs/srlinux-vlan-handling-lab
```

**Comment by thediveo** [comment]
I've updated the wget'able compose deployment files to enable debug logs for packetflix. Yes, that's definitely a bug, as "lo" is added when capturing from just "eth0".

**Comment by thediveo** [comment]
I'm afraid there is a layer 7 coding issue just between chair and keyboard 🤦🏼

**Comment by thediveo** [comment]
Fixed in v2.3.5, works on my machine...

BTW: if you click in Wireshark's capture window on the notepad in the statusbar, then the capture notes will show additional information inserted by Edgeshark. It will also show which nifs are captured from in this session.

**Comment by hellt** [comment]
@pcfriek1987 I have updated the ngrok demo, you can give it a try.
It works, thanks @thediveo!

**Comment by pcfriek1987** [comment]
I updated mine as well just now, works as should, thanks @thediveo !
